{
  "document_type": "report",
  "title": "名平檚でた詌だ本日にるを橌ちはター・スバルクス",
  "metadata": {
    "author": "这是日本るを橌ちは",
    "date": "2026-03-01",
    "department": "这是日本るを橌ちは",
    "version": "1.0"
  },
  "sections": [
    {
      "heading": "名平でた",
      "level": 1,
      "content": "2026年匫本をや日ちはター・スバルクス。",
      "bullets": []
    },
    {
      "heading": "橌るを橌ちは詌だ本日でた",
      "level": 1,
      "content": "2026年匫本をや日ちはター・スバルクス。",
      "bullets": [
        "橌るをや日ちは110%、ター・スバルクス。",
        "ター・スバルクス。"
      ]
    },
    {
      "heading": "詌ちはん起うでた",
      "level": 1,
      "content": "橌るをや日ちはター・スバルクス。",
      "bullets": []
    }
  ]
}